titre;id;abstract_type;publication_status;is_paid;reference;page_count;url;affiliations;is_approved;approved_date;downloads;author_1_id;author_1_last_name;author_1_first_name;author_1_url;author_2_id;author_2_last_name;author_2_first_name;author_2_url;author_3_id;author_3_last_name;author_3_first_name;author_3_url;author_4_id;author_4_last_name;author_4_first_name;author_4_url;paperDate;abstract;lang;lang_prob;lang_abs;lang_prob_abs;lang_match;and_count;author1_affi_raw;author2_affi_raw;author_1_institution;author_1_ror_url;author_1_country;author_1_ror_status;author_1_ror_id;author_2_institution;author_2_ror_url;author_2_country;author_2_ror_status;author_2_ror_id
Audit Exemptions and Compliance with Tax and Accounting Regulations;2944007;Accepted Paper Series;UNDER REVIEW;False;Forthcoming, Accounting and Business Research;65;https://papers.ssrn.com/sol3/papers.cfm?abstract_id=2944007;National Research University Higher School of Economics and BI Norwegian Business School - Department of Accounting, Auditing and Business Analytics;True;01 Apr 2017;286;1632514;Downing;Jeff;https://papers.ssrn.com/sol3/cf_dev/AbsByAuth.cfm?per_id=1632514;63048.0;Langli;John Christian;https://papers.ssrn.com/sol3/cf_dev/AbsByAuth.cfm?per_id=63048;;;;;;;;;2018-02-15;We examine small firms’ compliance with tax and accounting regulations before and after a change in the threshold for mandatory auditing. Prior to 2011, all Norwegian firms were required to be audited. In 2011, a law change allowed small Norwegian firms to choose not to be audited. After this change, the Norwegian Directorate of Taxes conducted on- and off-site inspections of a representative sample of 2,117 Norwegian firms, with a focus on compliance with specific requirements in tax and accounting regulation. We use the results from these inspections to construct a compliance quality score (CQS). We find that the firms that chose to opt out of auditing have lower CQS than do firms that chose to continue to be audited  that the CQS of firms that chose not to be audited declined after opting out  and that some of the opt-out firms fully mitigated the decline in CQS by engaging external accountants or auditors to prepare their annual financial statements. The results should be of interest to regulators considering increasing the thresholds for mandatory auditing, as our results show that (i) firms that choose not to be audited can experience a decline in CQS after opting out, and (ii) CQS can be maintained at the same level as before if opt-out firms engage external consultants that assist in preparing the annual accounts.;en;0.9485576152801514;en;0.9516300559043884;True;2;;;;;;empty_affiliation;;;;;empty_affiliation;
A System of Innovative Management Accounting Practices for Egyptian Manufacturers;2937483;Accepted Paper Series;UNDER REVIEW;False;Journal of Accounting, Ethics and Public Policy, Vol. 18, No. 1, 2017;35;https://papers.ssrn.com/sol3/papers.cfm?abstract_id=2937483;Abu Dhabi University and Abu Dhabi University;True;21 Mar 2017;220;1654396; Farouk Abdel Al;Sherine ;https://papers.ssrn.com/sol3/cf_dev/AbsByAuth.cfm?per_id=1654396;1595473.0;McLellan;John Daniel;https://papers.ssrn.com/sol3/cf_dev/AbsByAuth.cfm?per_id=1595473;;;;;;;;;2017-03-19;The purpose of this study is to examine the use of recently developed, strategically focused management accounting techniques by Egyptian managers and to compare the adoption rate to other MENA countries as Saudi Arabia, Kuwait and the United Arab Emirates. In addition, the paper aims at developing a system of innovative management accounting practices to assist Egyptian manufacturers be more strategically focused. Data was collected from the management of two hundred and fifteen Egyptian manufacturers on their use of a number of the recently developed management accounting practices. Results were compared to similar surveys of businesses in other MENA countries. Data was also collected on Egyptian manager’s perception to the strategic priorities and relative performance of their companies.Results indicate that approximately seventy-five percent of Egyptian manufacturers do not use activity based costing/activity based management, balanced scorecard or benchmarking techniques in the management of their businesses. Also, eighty percent of respondents indicate that the strategic priority for their company is to be a low cost producer. Respondents also stated that their firms were not performing at a high level.It is for that reason that the secondary purpose for this study was to examine the innovative management accounting literature to inform Egyptian management on the effective and efficient implementation of Activity based costing/Activity based management, balanced scorecard and benchmarking practices as management practices in their firm.This paper puts forth a “system” of innovative management accounting practices for managers to adapt to their respective business operations.;en;0.8259209990501404;en;0.9680734872817992;True;1;Abu Dhabi University;Abu Dhabi University;Abu Dhabi University;https://ror.org/01r3kjq03;United Arab Emirates;matched;01r3kjq03;Abu Dhabi University;https://ror.org/01r3kjq03;United Arab Emirates;matched;01r3kjq03
The Role and Current Status of IFRS in the Completion of National Accounting Rules – Evidence from Portugal;2934448;Accepted Paper Series;UNDER REVIEW;False;Accounting in Europe, A Journal of the European Accounting Association, Forthcoming;20;https://papers.ssrn.com/sol3/papers.cfm?abstract_id=2934448;ISCTE-IUL Instituto Universitario de Lisboa and ISCTE-IUL;True;20 Mar 2017;90;109129;Isidro;Helena;https://papers.ssrn.com/sol3/cf_dev/AbsByAuth.cfm?per_id=109129;2093020.0;Pais;Claudio;https://papers.ssrn.com/sol3/cf_dev/AbsByAuth.cfm?per_id=2093020;;;;;;;;;2017-03-07;We explain the process and documents that internalise the European Union (EU) Directive No. 2013/34 in Portugal. The Portuguese accounting standard setting body, the Comissão de Normalização Contabilística (CNC), is the entity in charge of the preparation and implementation of accounting standards. As such, CNC was responsible for the implementation of the EU Directive in Portugal. The Directive was approved by Decree-Law No. 98/2015 of 2 June 2015, but many important aspects of the Directive had already been adopted in Portugal when a new accounting system, designated Sistema de Normalização Contabilística (SNC), was introduced in 2009. Decree-Law No. 98/2015 of 2 June 2015 amends the SNC system to incorporate news aspects of the 2013 EU Directive. The current accounting rules in Portugal are strongly aligned with IFRS but some differences exist.;en;0.8676814436912537;en;0.946430802345276;True;1;ISCTE-IUL Instituto Universitario de Lisboa;ISCTE-IUL;Audax ISCTE;https://ror.org/038586y26;Portugal;matched;038586y26;;;;no_match;
Insider versus Outsider CEOS, Executive Compensation, and Accounting Manipulation;2935312;Accepted Paper Series;UNDER REVIEW;False;Journal of Accounting & Economics, Forthcoming Singapore Management University School of Accountancy Research Paper No. 2017-68;46;https://papers.ssrn.com/sol3/papers.cfm?abstract_id=2935312;Singapore Management University - School of Accountancy and University of Texas at Austin;True;20 Mar 2017;121;1985931;Jongjaroenkamol;Prasart;https://papers.ssrn.com/sol3/cf_dev/AbsByAuth.cfm?per_id=1985931;327269.0;Laux;Volker;https://papers.ssrn.com/sol3/cf_dev/AbsByAuth.cfm?per_id=327269;;;;;;;;;2017-03-17;This paper examines the role of the financial reporting environment in selecting a new CEO from within versus outside the organization. Weak reporting controls allow the CEO to misreport performance information, which reduces the board's ability to detect and replace poorly-performing CEOs as well as aggravates incentive contracting. We show that these adverse effects are stronger when the CEO is an outsider rather than an insider. Our model predicts that boards are more likely to recruit a CEO from the outside when the performance measures with which the new hire is assessed are harder to manipulate.;en;0.8489988446235657;en;0.9743116497993468;True;1;Singapore Management University - School of Accountancy;University of Texas at Austin;Singapore Management University;https://ror.org/050qmg959;Singapore;matched;050qmg959;The University of Texas at Austin;https://ror.org/00hj54h04;United States;matched;00hj54h04
Accounting and Economic Biases in Donations to NGO's is Scaling the New Overhead Myth in Charity Giving?;2934719;Working Paper Series;UNDER REVIEW;False;;14;https://papers.ssrn.com/sol3/papers.cfm?abstract_id=2934719;University of Colorado at Denver and Washington State University, Vancouver;True;20 Mar 2017;154;110086;Byrd;John W.;https://papers.ssrn.com/sol3/cf_dev/AbsByAuth.cfm?per_id=110086;2664903.0;Cote;Jane;https://papers.ssrn.com/sol3/cf_dev/AbsByAuth.cfm?per_id=2664903;;;;;;;;;2017-03-16;We examine how two trends in choosing which NGOs or not-for-profit organizations to support create biases in the types of organizations that are supported and how that bias in giving may affect the impact of international development organizations, especially those whose mission is sustainable development.  The two trends that we examine are: 1) basing funding decisions on an organization’s overhead-to-program expenses  and 2) basing funding on the ability of the organization to quickly scale up their activities.  Efficiency is appealing because donors want their contributions to be invested well.  Scaling is attractive because the need in the developing world is huge and scaling allows more of that need to be met.  While scale is a very appropriate metric for certain types of activities, as a sole funding decision criterion it has serious flaws.  We argue that these biases result in suboptimal development activities and that donors need to develop a much more complex and nuanced approach to giving, based on outcomes determined by the clients being served.;en;0.8845850825309753;en;0.9635505676269532;True;1;University of Colorado at Denver;Washington State University, Vancouver;University of Colorado Health;https://ror.org/0107w4315;United States;matched;0107w4315;Washington State University;https://ror.org/05dk0ce17;United States;matched;05dk0ce17
Challenges and Barriers of Adopting Fair Value Accounting for Real Estate Valuation in Public Listed Companies - Sri Lanka;2932669;Accepted Paper Series;UNDER REVIEW;False;American Research Thoughts, Vol. 1, Issue 1, November 2014;34;https://papers.ssrn.com/sol3/papers.cfm?abstract_id=2932669;University of Sri Jayewardenepura and University of Sri Jayewardenepura;True;15 Mar 2017;182;2486753;Gunawardhana;W.H.T.;https://papers.ssrn.com/sol3/cf_dev/AbsByAuth.cfm?per_id=2486753;2486598.0;Gunawardana;Kennedy;https://papers.ssrn.com/sol3/cf_dev/AbsByAuth.cfm?per_id=2486598;;;;;;;;;;Sri Lanka adopted IFRS with effect from 1st January 2012. With IFRS gaining rapid acceptance across the globe with over a 100 countries adopting it, Sri Lanka too is now in line with the global trend in enabling a common language for financial reporting processes following the adoption of IFRS. The Adoption of IFRS is a major breakthrough for companies in Sri Lanka as they will have a common, high quality and internationally accepted set of accounting and financial reporting standards and is also seen as a way forward to bring in ‘more credibility’ to financial reporting in the country. However, there are challenges and barriers to Sri Lanka in the process of adopting IFRS. Hence, this research was aimed to analyze Challenges and Barriers of Adopting Fair Value Accounting for Real Estate Assets Valuation in Sri Lanka Public Listed Companies. To accomplish this purpose, three objectives were developed and to achieve the objectives eighteen (18) hypotheses were developed and tested. The first objective was to find out the major determinant factors of adopting FVA for Real Estate Valuation. That was basically achieved through a solid literature review related to the problem statement. Accordingly five firms based characteristics and three behavioral factors of managers for of adopting FVA for Real Estate Valuation were identified. Second objective was tested to identify the relationship between firms based characteristics and behavioral factors of managers for of adopting FVA for Real Estate Valuation. Accordingly fifteen hypotheses were developed on firms based characteristics in terms of Firm Size, Leverage, Profitability, Amount of Real Estate and Extent of Expertise for Fair Value Accounting. The results obtained for all fifteen hypotheses were significant. Thus, the proposed link between firms based characteristics and behavioral factors of managers for adopting FVA for Real Estate Valuation was fully supported. Third objective was to identify the relationship between behavioural factors of managers and adoptability of FVA for Real Estate Valuation in PLCs’ in Sri Lanka. As per that, Attitudes, Subjective Norms, and Perceived Behavioural Control were considered as behavioural factors of managers as suggested in literature chapter. Three hypotheses were tested and all of them were significant to confirm the proposed link between behavioural factors of managers and adoptability of FVA for Real Estate Valuation in PLCs’ in Sri Lanka. The results obtained for second and third objectives, confirmed the barriers and challenges of adopting FVA for Real Estate Valuation in Sri Lankan context. Perceived Control is the most influencing factor, followed by Subjective Norms and Attitudes .As far as exogenous factors : firms based characteristics and endogenous factors: behavioral factors of managers for adopting FVA for Real Estate Valuation are concerned  Extent of Expertise for Fair Value Accounting has the most significant influence on Attitudes of mangers. Level of Leverage of company determines the Perceived Control of managers in the process of Fair Value adoptability. At the same time, Firm Size has a significant impact on Subjective Norms of managers in the process respectively.;en;0.8381948471069336;en;0.9722999930381776;True;1;University of Sri Jayewardenepura;University of Sri Jayewardenepura;University of Sri Jayewardenepura;https://ror.org/02rm76t37;Sri Lanka;matched;02rm76t37;University of Sri Jayewardenepura;https://ror.org/02rm76t37;Sri Lanka;matched;02rm76t37
The Role and Current Status of IFRS in the Completion of National Accounting Rules – Evidence from Slovenia;2929058;Working Paper Series;UNDER REVIEW;False;;19;https://papers.ssrn.com/sol3/papers.cfm?abstract_id=2929058;Faculty of Organizational Sciences (Deceased) and University of Ljubljana - Faculty of Economics;True;08 Mar 2017;112;2022161;Novak;Aleš;https://papers.ssrn.com/sol3/cf_dev/AbsByAuth.cfm?per_id=2022161;249442.0;Valentincic;Aljosa;https://papers.ssrn.com/sol3/cf_dev/AbsByAuth.cfm?per_id=249442;;;;;;;;;2017-03-07;We provide an overview of the role and current status of IFRS in the development of national accounting rules in Slovenia. The basic requirements of the financial reporting in Slovenia are set in the Companies Act, while the Slovenian accounting standards (SAS) provide a detailed authoritative guidance, especially on measurement. We describe the (historical) relations of all four editions of SAS with IFRS, provide explanations for the close alignment of SAS 2006 and SAS 2016 with IFRS, and identify major differences. In addition, the paper covers the adoption of the new EU accounting Directive into Slovenian legislation.;en;0.8772002458572388;en;0.912632405757904;True;1;Faculty of Organizational Sciences (Deceased);University of Ljubljana - Faculty of Economics;Faculty of Media;https://ror.org/00s8r8p14;Slovenia;matched;00s8r8p14;University of Ljubljana;https://ror.org/05njb9z20;Slovenia;matched;05njb9z20
Adoption of Forensic Accounting in Fraud Detection by Anti-Corruption Agency: A Conceptual Framework;2919881;Working Paper Series;UNDER REVIEW;False;;0;https://papers.ssrn.com/sol3/papers.cfm?abstract_id=2919881;Independent, Universiti Utara Malaysia and Universiti Utara Malaysia, College of Business, School of Accountancy;True;08 Mar 2017;0;1446709;Ibrahim;Umar Ibrahim;https://papers.ssrn.com/sol3/cf_dev/AbsByAuth.cfm?per_id=1446709;2265012.0;Samsudin;Rose Shamsiah;https://papers.ssrn.com/sol3/cf_dev/AbsByAuth.cfm?per_id=2265012;;;;;;;;;2017-02-18;Global incidences of fraudulent practices have led to the collapse of major businesses, public institution and governments. Fighting corruption requires the investigation, detection and prevention of frauds. Advancement in fraud detection process includes the use of forensic accounting and empirical studies reported its effectiveness in fraud detection process. However, there seems to be low adoption rate of forensic accounting by organization including anti-corruption agencies (ACAs). This study reviewed the literature to identify the probable factors that influence organization’s decision to adopt forensic accounting in fraud detection process and proposed a framework for an in-depth investigation into possible factors influencing Economic and financial Crimes Commission’s adoption of forensic accounting in Nigeria. In so doing, possible policy and academic implications will emerge which form the basis for implementation and further study.;en;0.8116254210472107;en;0.9315794706344604;True;1;Independent, Universiti Utara Malaysia;Universiti Utara Malaysia, College of Business, School of Accountancy;Northern University of Malaysia;https://ror.org/01ss10648;Malaysia;matched;01ss10648;Northern University of Malaysia;https://ror.org/01ss10648;Malaysia;matched;01ss10648
Are Entrenched Managers’ Accounting Choices More Predictive of Future Cash Flows?;2926072;Accepted Paper Series;UNDER REVIEW;False;Journal of Business Finance & Accounting (Forthcoming);0;https://papers.ssrn.com/sol3/papers.cfm?abstract_id=2926072;University of North Carolina (UNC) at Charlotte - Department of Accounting and Baylor University;True;02 Mar 2017;0;596797;Martin;Gregory W.;https://papers.ssrn.com/sol3/cf_dev/AbsByAuth.cfm?per_id=596797;658572.0;Lail;Bradley E.;https://papers.ssrn.com/sol3/cf_dev/AbsByAuth.cfm?per_id=658572;;;;;;;;;2017-03-01;We examine the role manager entrenchment has on firms’ financial reporting quality. More specifically, we test whether entrenched managers’ reported accruals deviate from industry norms and whether entrenched managers’ abnormal accruals are more (or less) predictive of future cash flows. Consistent with implications from prior research, we find that firms with entrenched managers generally report lower levels of abnormal accruals (in an absolute sense), but the abnormal accruals utilized by entrenched managers are more predictive of future cash flows. Contrary to a more traditional view of manager entrenchment, our evidence suggests that entrenched managers report higher quality abnormal accruals. While prior research provides evidence that manager entrenchment is associated with negative economic outcomes, we argue that attempts to limit entrenchment are unlikely to improve financial reporting quality and may actually lower quality. Future corporate governance should consider not only the level but also the quality of the association between accounting choices and manager entrenchment.;en;0.7771308422088623;en;0.944568932056427;True;1;University of North Carolina (UNC) at Charlotte - Department of Accounting;Baylor University;University of South Carolina;https://ror.org/02b6qw903;United States;matched;02b6qw903;Baylor University;https://ror.org/005781934;United States;matched;005781934
Innovation Accounting of Tax-Revenue Drivers: Cointegration Evidence from Ghana;2912550;Accepted Paper Series;UNDER REVIEW;False;The International Journal of Business and Finance Research,   v.  10   (3)  p.  83-95;14;https://papers.ssrn.com/sol3/papers.cfm?abstract_id=2912550;MedLab. Corp., Accra Ghana and North Carolina Central University (NCCU);True;23 Feb 2017;84;2649542;Amoah;George Maxwell;https://papers.ssrn.com/sol3/cf_dev/AbsByAuth.cfm?per_id=2649542;2649543.0;Amoateng;Kofi;https://papers.ssrn.com/sol3/cf_dev/AbsByAuth.cfm?per_id=2649543;;;;;;;;;;This study uses cointegration, and innovation accounting analysis to examine the volatility and extent of the short-term and long-term relationships between the drivers of tax revenues and tax revenues in Ghana from 1980 to 2011. The principal and consistent discovery from this study is that cocoa farmers’ tax (CFTAX) is the least volatile and import taxes (IMPTAX), is the most volatile in the observed period. The estimated cointegrating relationships identify at least two long-run vectors for the drivers of tax revenues. We also find that among the drivers of tax revenues, the cocoa farmers’ income taxes are the quickest to adjust to long-run equilibrium in the current year. The forecast error variance decompositions reveal that the cocoa farmers’ income taxes are the strongest endogenous of the VAR system driver of tax revenues, and that they play a dominant role in Ghanaian tax revenues in the observed period. The empirical evidence supports the descriptive statistics that cocoa farmers’ income tax revenues remain the largest and most reliable source of income for the Ghanaian economy. Since tax revenues from cocoa farmers continue to drop because of falling cocoa futures and low production, Ghanaian policymakers must diversify their taxrevenue drivers to include a sales tax on discretionary goods and services such as imported tobacco and imported alcohol. As tax revenue increase option has become elusive, the hardline option is to gradually eliminate government expenditures in the areas of colonial delicacies such as free fuel, chauffeurs for government officials (ministers and members of parliament etc), excessive per diems from the president to other government officials and many more, just to mention but few.;en;0.7572221755981445;en;0.9562106728553772;True;1;MedLab. Corp., Accra Ghana;North Carolina Central University (NCCU);Environmental Protection Agency;https://ror.org/03m8km719;Ghana;matched;03m8km719;North Carolina Central University;https://ror.org/051r3tx83;United States;matched;051r3tx83
Accounting Discretion, Market Discipline and Bank Behaviour: Some Insights from Fair Value Accounting;2920491;Working Paper Series;UNDER REVIEW;False;Bank of England Working Paper No. 647;37;https://papers.ssrn.com/sol3/papers.cfm?abstract_id=2920491;Bank of England and Bank of England;True;20 Feb 2017;223;1449138;Bouther;Regis;https://papers.ssrn.com/sol3/cf_dev/AbsByAuth.cfm?per_id=1449138;1578795.0;Francis;William B.;https://papers.ssrn.com/sol3/cf_dev/AbsByAuth.cfm?per_id=1578795;;;;;;;;;2017-02-17;Using quarterly data on FAS 157 fair value disclosures for US bank holding companies from 2008 to 2013, we test whether capital ratios and the effects of market discipline differ according to extent and nature of assets recognized under Level 3 standards. These standards offer management significant discretion for measuring fair values, potentially reducing bank transparency and affecting market perceptions about bank risk. We find limited evidence that capital ratios are lower at institutions engaging in Level 3 trading activities for given risk levels, consistent with opportunistic behaviour. We also find that market discipline, as measured by whether an institution has a US stock exchange listing or dependence on short-term, uninsured funding sources, is effective in moderating this behaviour. At these institutions capital ratios are higher, consistent with there being a direct (ex ante) disciplining effect on bank behaviour.;en;0.8626641035079956;en;0.9233285188674928;True;1;Bank of England;Bank of England;Bank of England;https://ror.org/04p3y0q03;United Kingdom;matched;04p3y0q03;Bank of England;https://ror.org/04p3y0q03;United Kingdom;matched;04p3y0q03
Accounting Discretion, Market Discipline and Bank Behaviour: Some Insights from Fair Value Accounting;2919409;Working Paper Series;UNDER REVIEW;False;Bank of England Working Paper No. 647;37;https://papers.ssrn.com/sol3/papers.cfm?abstract_id=2919409;Bank of England and Bank of England;True;17 Feb 2017;56;1449138;Bouther;Regis;https://papers.ssrn.com/sol3/cf_dev/AbsByAuth.cfm?per_id=1449138;572291.0;Francis;William;https://papers.ssrn.com/sol3/cf_dev/AbsByAuth.cfm?per_id=572291;;;;;;;;;;Using quarterly data on FAS 157 fair value disclosures for US bank holding companies from 2008 to 2013, we test whether capital ratios and the effects of market discipline differ according to extent and nature of assets recognized under Level 3 standards. These standards offer management significant discretion for measuring fair values, potentially reducing bank transparency and affecting market perceptions about bank risk. We find limited evidence that capital ratios are lower at institutions engaging in Level 3 trading activities for given risk levels, consistent with opportunistic behaviour. We also find that market discipline, as measured by whether an institution has a US stock exchange listing or dependence on short-term, uninsured funding sources, is effective in moderating this behaviour. At these institutions capital ratios are higher, consistent with there being a direct (ex ante) disciplining effect on bank behaviour.;en;0.8626641035079956;en;0.9233285188674928;True;1;Bank of England;Bank of England;Bank of England;https://ror.org/04p3y0q03;United Kingdom;matched;04p3y0q03;Bank of England;https://ror.org/04p3y0q03;United Kingdom;matched;04p3y0q03
