titre;id;abstract_type;publication_status;is_paid;reference;page_count;url;affiliations;is_approved;approved_date;downloads;author_1_id;author_1_last_name;author_1_first_name;author_1_url;author_2_id;author_2_last_name;author_2_first_name;author_2_url;author_3_id;author_3_last_name;author_3_first_name;author_3_url;author_4_id;author_4_last_name;author_4_first_name;author_4_url;paperDate;abstract;lang;lang_prob;lang_abs;lang_prob_abs;lang_match;and_count;author1_affi_raw;author2_affi_raw;author_1_institution;author_1_ror_url;author_1_country;author_1_ror_status;author_1_ror_id;author_2_institution;author_2_ror_url;author_2_country;author_2_ror_status;author_2_ror_id
Distortionary Effects of State Trading in Agriculture: Issues for the Next Round of Multilateral Trade Negotiations;620590;Working Paper Series;UNDER REVIEW;False;;39;https://papers.ssrn.com/sol3/papers.cfm?abstract_id=620590;World Bank - International Trade Division and World Bank - Development Research Group (DECRG);True;20 Apr 2016;172;289319;Ingco;Merlinda ;https://papers.ssrn.com/sol3/cf_dev/AbsByAuth.cfm?per_id=289319;48426.0;Ng;Francis;https://papers.ssrn.com/sol3/cf_dev/AbsByAuth.cfm?per_id=48426;;;;;;;;;;The Uruguay Round agreements on agriculture were intended to move member countries toward a fair and market-oriented agricultural trading system. But in practice, state trading enterprises with monopoly power or exclusive rights in agricultural trade in major products still prevail in many countries. And significant price distortions still exist in trade in products subject to state trading.The Uruguay Round agreements on agriculture were intended to move member countries toward a fair and market-oriented agricultural trading system.  By progressively reducing domestic government support and export subsidies, converting nontariff barriers to tariffs, and reducing barriers to market access, members were committed to reducing distortions in world agricultural trade and in preventing new distortions from arising.But state trading enterprises with monopoly power or exclusive rights in agricultural trade in major products are still prevalent in both industrial and developing countries. In many countries, the operations of these state trading agencies tend in practice to nullify the intended objectives of the concessions on market access reached in the Uruguay Round. And there are still significant price distortions in trade in products subject to state trading.This paper - a product of the Development Research Group - is part of a larger effort in the group to evaluate the progress of trade liberalization and their effects on developing countries.;en;0.8930428624153137;en;0.949155330657959;True;1;World Bank - International Trade Division;World Bank - Development Research Group (DECRG);World Bank;https://ror.org/00ae7jd04;United States;matched;00ae7jd04;World Bank;https://ror.org/00ae7jd04;United States;matched;00ae7jd04
Agriculture and the Macroeconomy;620527;Working Paper Series;UNDER REVIEW;False;;39;https://papers.ssrn.com/sol3/papers.cfm?abstract_id=620527;Fellow, Institute for the Study of Labor (IZA) and Pontifical Catholic University of Chile - Department of Agricultural Economics;True;20 Apr 2016;553;55120;Schiff;Maurice;https://papers.ssrn.com/sol3/cf_dev/AbsByAuth.cfm?per_id=55120;350616.0;Valdes;Alberto;https://papers.ssrn.com/sol3/cf_dev/AbsByAuth.cfm?per_id=350616;;;;;;;;;1998-03-24;This paper surveys the literature on the interaction between agriculture and the macroeconomy in both industrial and developing countries, identifying what the authors believe to represent its most significant contributions and shortcomings.Based on an economy-wide perspective, this paper begins with a discussion of the bias against exports and agriculture that characterized the economic literature and the development strategies in many developing countries after World War II. This is followed by an analysis of how the macroeconomic environment affects agricultural price incentives.  Specifically, the paper discusses how policies concerning industrial protection, exchange rates, and interest rates and other fiscal policies can strongly influence the economic incentives for agriculture compared with other sectors, identifying the most relevant literature and alternative approaches used on this issue. It then proceeds to examine how the real exchange rate can be affected by exogenous shocks, such as the foreign terms of trade, with emphases on the Dutch Disease phenomenon and agriculture. The paper next examines the influence of interest rates on incentives in agriculture, arguing that, surprisingly, this has been a neglected area in the literature.The paper explores the effects on agriculture of structural adjustment programs implemented since the early 1980s in developing countries. The final section surveys the literature on agriculture and the macroeconomy in industrial countries, focusing on the impact of the exchange rate on export competitiveness in the United States, the cost of agricultural protection for the overall economy in Europe and Japan, and the increased importance of fluctuations in money markets for the farm sector and the additional instability they generate.This paper - a joint product of Trade, Development Research Group, and the Rural Development Department - will be published in B. Gardner and G.  Rausser, eds., Handbook of Agricultural Economics, North Holland Publishers.;en;0.7734618782997131;en;0.9183672070503236;True;1;Fellow, Institute for the Study of Labor (IZA);Pontifical Catholic University of Chile - Department of Agricultural Economics;IZA - Institute of Labor Economics;https://ror.org/029s44460;Germany;matched;029s44460;Pontificia Universidad Católica de Chile;https://ror.org/04teye511;Chile;matched;04teye511
Deregulating Technology Transfer in Agriculture: Reform's Impact on Turkey in the 1980s;614976;Working Paper Series;UNDER REVIEW;False;;62;https://papers.ssrn.com/sol3/papers.cfm?abstract_id=614976;World Bank  and Rutgers, The State University of New Jersey - Agricultural, Food & Resource Economics;True;20 Apr 2016;142;124214;Gisselquist;David;https://papers.ssrn.com/sol3/cf_dev/AbsByAuth.cfm?per_id=124214;333506.0;Pray;Carl E.;https://papers.ssrn.com/sol3/cf_dev/AbsByAuth.cfm?per_id=333506;;;;;;;;;;Liberalizing the regulation and welcoming the private delivery of inputs and technology greatly increased the private transfer of technology to Turkish farmers. Regulatory reform in Turkey allowed private firms to increase their share of input markets and allowed farmers to significantly increase yields and production.Turkey is one of a handful of developing countries that have liberalized regulation of agricultural inputs and welcomed private firms delivering technology and inputs. Gisselquist and Pray show that Turkish regulatory reform affecting seeds and other inputs in the 1980s:° Greatly increased private technology transfer into Turkey.° Encouraged market entry for more foreign and domestic companies involved in production and trade in Turkey.° Allowed private firms to increase their share of input markets.° Where inputs brought new technology, allowed farmers to significantly increase yields and production.Gisselquist and Pray recommend that the World Bank and other donors involved with agriculture pay more attention to the regulation of inputs in developing countries. They also recommend that developing country governments revise regulations to leave choices about technology performance to farmers and markets-and to focus instead on externalities, removing unnecessary obstacles to private technology transfer through the production and trade of inputs.Other countries that have similarly reformed the regulation of agricultural inputs include Chile (in the 1970s), Bangladesh and India (at the end of the 1980s), Malawi (in 1995-96), and Romania (in 1997).This paper - a product of Trade, Development Research Group - is one of four country case studies of regulatory reform for agricultural inputs.  Other studies examine the impact of regulatory reform in Bangladesh, India, and Zimbabwe (where reform was partial). This study was funded by the Bank's Research Support Budget under research project Regulating Technology Transfer: Impact on Technical Change, Productivity, and Incomes. David Gisselquist may be contacted at dgisselquist@worldbank.org.;en;0.9037620425224304;en;0.9209735989570618;True;1;World Bank;Rutgers, The State University of New Jersey - Agricultural, Food & Resource Economics;World Bank;https://ror.org/00ae7jd04;United States;matched;00ae7jd04;Rutgers, The State University of New Jersey;https://ror.org/05vt9qd57;United States;matched;05vt9qd57
Trade Policies and Incentives in Indian Agriculture: Methodology, Background Statistics and Protection, and Incentive Indicators, 1965-95;614980;Working Paper Series;UNDER REVIEW;False;;100;https://papers.ssrn.com/sol3/papers.cfm?abstract_id=614980;World Bank and Georgetown University - Department of Economics;True;20 Apr 2016;275;415250;Pursell;Garry;https://papers.ssrn.com/sol3/cf_dev/AbsByAuth.cfm?per_id=415250;415253.0;Gupta;Anju;https://papers.ssrn.com/sol3/cf_dev/AbsByAuth.cfm?per_id=415253;;;;;;;;;;This paper describes the methodology for a series of background papers that measure incentives in India's agriculture. The first study on sugarcane and sugar shows that the domestic market has been isolated from world markets by extensive controls, but between 1965 and 1995 there was a significant downward trend in the ratio of domestic to international sugar prices.This paper is the first in a series of studies to provide background data and protection and incentive indicators for 13 major Indian crops, which have been estimated in connection with extensive research on Indian agricultural incentives. The general methodology of the studies is described in the first section of the paper. The second section of the paper focuses on sugarcane and sugar. It shows that between 1965 and 1994 real domestic prices of sugar and cane were quite stable in India, declining an average of 0.6 percent (sugar) and 0.3 percent (cane) a year. During the same 29 years the free market price of sugar fluctuated widely (expressed in Indian rupees) but in real terms increased about 1.3 percent a year.This contrast in trends reflects the real devaluation of the rupee after 1986 but meant that by the early 1990s, at world sugar prices of US 13-15 cents a pound or higher, India`s domestic prices were roughly equivalent to, or below, world reference prices. Because of the fluctuations in world free market prices, nominal protection of sugar and sugarcane production in India - as measured by differences between domestic prices and border reference prices - also fluctuated. Nominal protection was:High during low world prices in the 1960s and the mid-1980s.Negative when world prices were high in the mid-1970s and early 1980s.Moderate to low by previous standards between 1989 and 1994.Incentives for cane production did not change much when allowance is made for the nominal protection of tradable inputs (principally fertilizers) or subsidies for the principal nontradable imports (canal irrigation, credit, and electricity for pumpsets). Incentives for cane production were somewhat higher in Uttar Pradesh than in Maharashtra and Tamil Nadu. Half of Indian cane production is used by artisanal producers of gur and small-scale de facto unregulated producers of khandsari sugar. Because of India's complex regulatory system - especially in the important sugar-producing state, Uttar Pradesh - incentives are significantly higher for unregulated activities than for the modern sugar mill sector. Regulations subject sugar mills to controls that require them to:Sell specific quantities of their sugar production at low levy prices.Sell molasses production at a fraction (0.1 or less) of open market and border prices.Pay minimum prices (for specific quantities of cane) at above-free-market prices, except in years of cane shortages.This paper is a product of Trade, Development Research Group.;en;0.7492332458496094;en;0.9490718841552734;True;1;World Bank;Georgetown University - Department of Economics;World Bank;https://ror.org/00ae7jd04;United States;matched;00ae7jd04;Georgetown University;https://ror.org/05vzafd60;United States;matched;05vzafd60
Adjustment and Poverty in Mexican Agriculture: How Farmers Wealth Affects Supply Response;569237;Working Paper Series;UNDER REVIEW;False;;54;https://papers.ssrn.com/sol3/papers.cfm?abstract_id=569237;Department of Agricultural & Resource Economics and St. Joseph's University - Department of Marketing;True;20 Apr 2016;162;360424;López;Ramón;https://papers.ssrn.com/sol3/cf_dev/AbsByAuth.cfm?per_id=360424;388517.0;Stanton;Julie;https://papers.ssrn.com/sol3/cf_dev/AbsByAuth.cfm?per_id=388517;;;;;;;;;;By and large, it appears that the goals of agricultural reform are being met in Mexico.  But measures such as decoupling income supports and price supports or reorienting research and extension could help farmers who cannot afford access to machinery and purchased inputs and services.Lopez, Nash, and Stanton report the results of a study of Mexican farm households using 1991 survey data and a smaller resurvey of some of the same households in 1993.One study goal was to empirically examine the relationship between assets and the output supply function.  Using a production model focusing on capital as a productive input, they found that both the supply level and the responsiveness (elasticities) to changing input and output prices tend to depend on the farmer's net assets and on how productive assets are used.  Regression analysis using data from the surveys shows that farmers who use productive assets such as machinery tend to be positively responsive to price changes, while those with no access to such assets are not.Another study goal was to monitor the condition of Mexican farmers in a rapidly changing policy environment.  The 1991 survey data suggest that farmers with more limited use of capital inputs (the low-CI group) were more likely to grow principally corn and to grow fewer crops, on average, than the others.  They also had more problems getting credit and were less likely to use purchased inputs, such as seeds, fertilizer, and pesticides, or to use a tractor to prepare the soil.  They tended to be less well-educated, and their land tended to be of lower quality.Results from the panel data showed conditions generally improving for the average farmer in the sample area between 1991 and 1993, during a period when agricultural reforms were implemented.  Cropping patterns were more diversified, the average size of landholdings increased, the average farmer received more credit (in real terms), more farm households earned income from off-farm work, and more farmers used purchased inputs.  Asset ownership and educational attainment also improved modestly.The very small low-CI group in this sample fared as well as, or better than, the other groups.  True, their level of educational achievement fell, and fewer of them had off-farm income than in 1991.  But their use of credit, irrigation, machinery, and purchased inputs increased more than for other groups.The limited data are not proof of a causal link, but the fact that the goals are being met should at least ensure that adverse conditions are not undermining reform.Farmers that lacked access to productive assets did not respond as well to incentives or take advantage of the opportunities presented by reform and may need assistance, particularly to get access to credit markets.  There may be a good argument for decoupling income supports from price supports for farmers, since income payments that are independent of the vagaries of production could provide a more stable signal of creditworthiness than price supports do.Possibly reorienting research and extension services more to the needs of low-CI producers could also improve the efficiency with which the sector adjusts to new incentives.Hypotheses and tentative conclusions from this study will be explored further when more data are collected in 1995.This paper - a product of the International Trade Division, International Economics Department - is part of a larger effort in the department to investigate the effects of international trade policy on individual producers.  The study was funded by the Bank's Research Support Budget under the research project Rural Poverty and Agriculture in Mexico: An Analysis of Farm Decisions and Supply Responsiveness (RPO 678-23).;en;0.9029085040092468;en;0.9691945910453796;True;1;Department of Agricultural & Resource Economics;St. Joseph's University - Department of Marketing;Department of Agriculture;https://ror.org/001ke5c68;Belize;matched;001ke5c68;Saint Joseph's University;https://ror.org/05q87sg56;United States;matched;05q87sg56
Developing Country Agriculture and the New Trade Agenda;569201;Working Paper Series;UNDER REVIEW;False;;27;https://papers.ssrn.com/sol3/papers.cfm?abstract_id=569201;European University Institute - Robert Schuman Centre for Advanced Studies (RSCAS) and University of Adelaide - Centre for International Economic Studies (CIES);True;20 Apr 2016;182;795;Hoekman;Bernard;https://papers.ssrn.com/sol3/cf_dev/AbsByAuth.cfm?per_id=795;24677.0;Anderson;Kym;https://papers.ssrn.com/sol3/cf_dev/AbsByAuth.cfm?per_id=24677;;;;;;;;;;In the new round of World Trade Organization talks expected in late 1999, negotiations about access to agricultural and services markets should be given top priority, but new trade agenda issues should also be discussed.Including new trade agenda issues would increase market discipline's role in the allocation of resources in agriculture and would encourage nonagricultural groups with interests in the new issues to take part in the round, counterbalancing forces favoring agricultural protection.A new round of World Trade Organization negotiations on agriculture, services, and perhaps other issues is expected in late 1999. To what extent should those negotiations include new trade agenda items aimed at ensuring that domestic regulatory policies do not discriminate against foreign suppliersHoekman and Anderson argue that negotiations about market access should be given priority, as the potential welfare gains from liberalizing access to agricultural (and services) markets are still huge, but new issues should be included too.Including new trade agenda issues would increase the role of market discipline in the allocation of resources in agriculture and would encourage nonagricultural groups with interests in the new issues to take part in the round, counterbalancing forces in favor of agricultural protection.They also argue, however, that rule-making efforts to accommodate the new issues should be de-linked from negotiations about access to agricultural markets, because the issues affect activity in all sectors.This paper - a product of the Development Research Group - is part of a larger effort in the group to analyze options and priorities for developing countries in the run-up to a new round of WTO negotiations.;en;0.7093003988265991;en;0.9443395137786864;True;1;European University Institute - Robert Schuman Centre for Advanced Studies (RSCAS);University of Adelaide - Centre for International Economic Studies (CIES);European University Institute;https://ror.org/0031wrj91;Italy;matched;0031wrj91;The University of Adelaide;https://ror.org/00892tw58;Australia;matched;00892tw58
Agriculture: Import Substitution&rsquos &lsquoFRUTS&rsquo;2757632;Working Paper Series;UNDER REVIEW;False;Russian Economic Developments. 2016, Moscow, IEP Publishers, pp. 73-76;4;https://papers.ssrn.com/sol3/papers.cfm?abstract_id=2757632;affiliation not provided to SSRN , Russian Academy of National Economy and Public Administration under the President of the Russian Federation (RANEPA) - Institute of Applied Economic Research and Russian Academy of National Economy and Public Administration under the President of the Russian Federation (RANEPA);True;02 Apr 2016;81;1999874;Shagaida;Natalia;https://papers.ssrn.com/sol3/cf_dev/AbsByAuth.cfm?per_id=1999874;2112391.0;Uzun;Vasily;https://papers.ssrn.com/sol3/cf_dev/AbsByAuth.cfm?per_id=2112391;;;;;;;;;2016-04-01;The food embargo has failed to create favorable conditions for Russia’s agricultural production to thrive. Instead, such conditions arose as a result of the ruble’s devaluation, when imported goods had lost their competitive capacity in Russia’s domestic market. On the one hand, the ruble’s declining exchange rate against the world’s major currencies made life more difficult for Russian agricultural producers, because imported resources became more expensive  while on the other, in 2015 they could still increase their production of major categories of edible plants and modify their productaion structure in accordance with the structure of demand in the domestic and foreign markets.;en;0.3377287685871124;en;0.9481620192527772;True;3;;;;;;empty_affiliation;;;;;empty_affiliation;
Measuring Women's Disempowerment in Agriculture in Pakistan;2752593;Accepted Paper Series;UNDER REVIEW;False;IFPRI Discussion Paper 1512;48;https://papers.ssrn.com/sol3/papers.cfm?abstract_id=2752593;International Food Policy Research Institute (IFPRI) and International Food Policy Research Institute (IFPRI);True;22 Mar 2016;97;2528425;Ahmad;Nuzhat;https://papers.ssrn.com/sol3/cf_dev/AbsByAuth.cfm?per_id=2528425;2528429.0;Khan;Huma;https://papers.ssrn.com/sol3/cf_dev/AbsByAuth.cfm?per_id=2528429;;;;;;;;;2016-02-26;Pakistan performs poorly with respect to gender equality, women’s empowerment, and other gender-related indicators. Few studies in Pakistan measure the multiple dimensions of empowerment along which women are marginalized or disenfranchised, particularly in the country’s rural areas. Even fewer studies address the gender gaps in empowerment levels of men and women. This paper calculates a Women’s Disempowerment Index to examine women’s control over production, resources, income, household decisions, and time burden. The index is based on a slightly modified methodology than that used for WEAI calculation by Alkire et al. (2012). The analysis is based on a sample of 2,090 households in the rural areas of Pakistan. Data used for the study were collected in three rounds of the Pakistan Rural Household Panel Survey from 2012–2014 by International Food Policy Research Institute/Innovative Development Strategies for its Pakistan Strategy Support Program. The results show low empowerment levels of only 17 percent for women in the rural areas of Pakistan. The results also show very low empowerment of women in all indicators and domains except the time burden/workload indicator. We then analyze women’s disempowerment by subsamples based on individual and household characteristics. We also calculate disempowerment levels among men and compare it to disempowerment levels among women. Comparison within the household reveals large disparities in empowerment levels among men and women. In a comparative analysis, men are found to be more empowered in domains of production, income, and autonomy. Both men and women were found to be most disempowered in access to and control over resources. The paper provides a baseline for tracking women’s empowerment over time and identifies areas that need to be strengthened through policy interventions.;en;0.814816951751709;en;0.9372450709342957;True;1;International Food Policy Research Institute (IFPRI);International Food Policy Research Institute (IFPRI);International Food Policy Research Institute;https://ror.org/03pxz9p87;United States;matched;03pxz9p87;International Food Policy Research Institute;https://ror.org/03pxz9p87;United States;matched;03pxz9p87
Scoping for Innovation in Agriculture and Technology Transfer - Approaches in Ecological and Marketing Principles;2749073;Working Paper Series;UNDER REVIEW;False;;5;https://papers.ssrn.com/sol3/papers.cfm?abstract_id=2749073;Barkatullah University and Barkatullah University;True;19 Mar 2016;181;2527042;Singh;R.;https://papers.ssrn.com/sol3/cf_dev/AbsByAuth.cfm?per_id=2527042;2526222.0;Armo;Dr. C.S.;https://papers.ssrn.com/sol3/cf_dev/AbsByAuth.cfm?per_id=2526222;;;;;;;;;2016-03-11;Indian agricultural system has faced serious problems of environmental and ecosystem degradation since colonial periods. Attempts of technology transfer in green revolution for food security resulted in increased production of rice, wheat etc. in selected regions, nevertheless it has resulted serious environmental and economic conflicts. Large majority of areas have become drought and flood prone in centralized globalization. The privatization and globalization policy requires policies for sustainable growth of agricultural systems and innovation rather than simply transfer of exogenously developed technologies leading to environmental degradation, increased costs of production and suicides.This paper provides principles and approaches of innovations in agricultural systems in India under the conditions of serious environmental crises in agro-ecosystems and failure of transfer of technology for agro-ecosystem restoration in agro-climatic regions, issues of sustainable growth of agriculture on the ecological and economic principles, policy evaluation of technology transfer and strategic planning for innovation in agriculture.;en;0.838063657283783;en;0.924875020980835;True;1;Barkatullah University;Barkatullah University;Barkatullah University;https://ror.org/02ax13658;India;matched;02ax13658;Barkatullah University;https://ror.org/02ax13658;India;matched;02ax13658
